<!DOCTYPE flight_plan SYSTEM "flight_plan.dtd">

<flight_plan NAME="example - Muret for loops" LON0="1.27289" MAX_DIST_FROM_HOME="1000" GROUND_ALT="185" SECURITY_HEIGHT="25" QFU="270" ALT="250" LAT0="43.46223">

  <waypoints utm_x0="360284.8" utm_y0="4813595.5">
    <waypoint name="HOME" x="0.0" y="30.0" lat="43.4625000078" lon="1.27288231142" alt="250."/>
     </waypoints>

  <blocks>
    <block NAME="home">
       <exception COND="(RcEvent1())" DEROUTE="follow"/>
       <circle wp="HOME" alt="GROUND_ALT+50" radius="-75"/>
    </block>

    <block NAME="follow">
       <exception COND="(RcEvent1())" DEROUTE="home"/>
      <follow ac_id="3" distance="50" height="20"/>
    </block>
  </blocks>
</flight_plan>

