<!DOCTYPE flight_plan SYSTEM "flight_plan.dtd">

<flight_plan NAME="Muret clover" LON0="1.27289" MAX_DIST_FROM_HOME="1000" GROUND_ALT="185" SECURITY_HEIGHT="25" QFU="270" ALT="250" LAT0="43.46223">

  <waypoints utm_x0="360284.8" utm_y0="4813595.5">
    <waypoint name="HOME" x="0.0" y="30.0" lat="43.4625000078" lon="1.27288231142" alt="250."/>
     </waypoints>

     <include name="clover" procedure="clover.xml" x="0" y="0" rotate="0">
     <arg name="rad" value="50"/>
     <with from="event1" to="home"/>
     </include>

  <blocks>
    <block NAME="home">
      <exception COND="(RcEvent1())" DEROUTE="clover.go"/>
      <circle wp="HOME" alt="GROUND_ALT+50" radius="50"/>
    </block>
  </blocks>
</flight_plan>

